id	customerJobCode	active	postingDate_year	postingDate_month	postingDate_day	expirationDate_year	expirationDate_month	expirationDate_day	postingTimestamp	expirationTimestamp	company_id	company_name	position_title	position_location_country_code	position_location_name	position_jobFunctions_values	position_industries_values	position_jobType_code	position_jobType_name	position_experienceLevel_code	position_experienceLevel_name	skillsAndExperience	descriptionSnippet	description	salary	jobPoster_id	jobPoster_firstName	jobPoster_lastName	jobPoster_headline	referralBonus	siteJobUrl	locationDescription
3925016	NA	True	2012	10	10	2013	1	8	1349877552000	1357653552000	18801	The Allant Group	Data Scientist (Statistician)	us	Greater Boston Area	[{"code": "cnsl", "name": "Consulting"}, {"code": "mrkt", "name": "Marketing"}]	[{"code": "113", "id": 113, "name": "Online Media"}, {"code": "80", "id": 80, "name": "Marketing and Advertising"}, {"code": "96", "id": 96, "name": "Information Technology and Services"}]	F	Full-time	3	Associate	<p><strong>Requirements</strong> </p><ul><li>Bachelors degree (Masters preferred) in Business, Marketing, Mathematics, Statistics, Economics or other quantitative discipline </li><li>10+ years of work experience with and passion for creating marketing data products </li><li>Product development and/or extensive client-side experience with segmentation systems like Claritas PRIZM, Experian MOSAIC, Acxiom Personicx, or Simulmedia </li><li>Experience integrating multiple third-party data sources (demographics, psychographics, automotive, financial, political, etc.) to discover creative, valuable audience clusters that could best meet advertiser audience targeting needs </li><li>Veteran practitioner of statistical clustering methods and probability modeling as well as direct and/or interactive marketing test design </li></ul><ul><li>Technical expert in data extraction, manipulation, and visualization tools such as SAS, SPSS, SQL, Excel, Tableau, QlikView, and/ or others with minimal supervision. Hands-on comfort with scripting languages like Perl, Python, or R is a plus </li><li>Critical thinking capable of generating consistently accurate, useful reports as well as a enthusiasm for translating data into actionable insight relevant to marketing program objectives </li><li>Strong quantitative and research skills with ability to demonstrate data interpretation capabilities in terms of insight with business context </li><li>Balances desire for quantitative rigor with realities of inconsistent business data </li><li>Ability to articulate strategic marketing implications of campaign performance results for business audiences with clarity and persuasiveness </li><li>Knowledgeable of the media planning, measurement, and optimization process and acumen (both online and offline)</li></ul>	NA	<p>We are currently looking to fill a <strong>Data Scientist</strong> role in our growing team based in Burlington, MA. <p></p></p><p>The Data Scientist is an individual contributor that will be responsible for supporting the design, development, and delivery of an audience segmentation system. This segmentation system will serve as the foundation for multiple video advertising products  both derived data as well as tools. Ad sales teams will use these products to define advanced advertising campaigns with their advertiser and agency clients. Audience segments will be used consistently for campaign selection, execution, and measurement across traditional TV, VOD and Internet video platforms. <p></p></p><p>This role will be focused on iterative, exploratory data analysis against a deep, national set of household-level data. The goal of this work is to produce multiple derived and pre-packaged audience segmentation schemes which will directly support advanced advertising ad sales products. These schemes may be tailored to the needs of specific industries or marketing applications. The Data Scientist will work closely with technical and product peers who will develop audience selection and reporting tools for use by ad sales organizations. </p><p> </p><p><strong>Duties and Responsibilities</strong> </p><p>Primary responsibilities for this position include but are not limited to: </p><ul><li>Participate in ideation of new, derived data solutions that Allant could uniquely provide to the marketplace based on command of cable operator and TV/ video advertising ecosystem<ul><li>TV/ video media planners and buyers (advertisers as well as agencies) </li><li>TV/ video media sellers (content networks/ programmers as well as distributors) </li><li>Media exchange solution providers (ad networks, data vendors, distribution partners) </li><li>Act as an advanced advertising data subject matter expert (SME)<ul><li>Build up a strong understanding and expert knowledge of the various data sources brought together for AMP  MVPD video subscriber attributes, 3rd-party data provider attributes across ad industries, and TV/ video campaign and media activity (across ad formats/ channels) </li><li>Guide Allant client and/ or capability teams on how to creatively leverage this rich data asset for their respective insight or segmentation needs </li><li>Identify data gaps and advocate for additional data sources to add to AMP to meet some unmet marketplace need(s) </li></ul></li></ul></li><li>Be an analytical approach artisan<ul><li>Design a creative segmentation methodology that balances efficiency and performance for buyers, scale and reproducibility for sellers, and privacy-safe for viewers </li><li>Outline pragmatic solutions to answering the insight need at hand with an eye toward balancing quantitative rigor, data incompleteness, and timelines conducive to rudimentary vs. sophisticated statistical methods </li><li>Prescribe data sets, cross-table joins, and/ or DB views needed for exploration analysis and/ or algorithm development to a DB Support team </li><li>Collaborate with Product and Engineering teams on analysis or derived data requirements and possible solution paths </li><li>Trial, refine, and validate segment definitions through a disciplined test-and-learn approach of in-market campaign pilots or simulations (across video channels) </li></ul></li><li>Participate in standardizing, packaging, documenting, and automating privacy-safe audience segments for use in addressable video advertising </li><li>Evangelize derived data solutions with client constituencies (MVPD/ cable operators selling TV/ video inventory, advertisers/ agencies buying TV/ video inventory, measurement vendor partners) and the advanced advertising industry at large (community events, conferences, white papers, marketing collateral) </li><li>Build and foster positive reputation with Allant client delivery teams and Platform Product &amp; Engineering teams to successfully collaborate on designing, building, and launching derived data solutions </li><li>Collaborate with inter-disciplinary internal team in the development and integration of audience segments with campaign execution tools associated with audience selection, media scheduling guidance, cross-format inventory assessment and forecasting, audience valuation, reserving and contracting, and performance insight for optimization </li><li>Work efficiently (both independently and collaboratively) to define, configure, extract, aggregate, manipulate, diagnose/ QA, validate, package, synthesize, and share data, results, and insight with Allant team members and clients </li><li>Prepare and present compelling analytical presentations and persuasively communicate (both in writing and verbally) complex concepts to marketing and business audiences </li><li>Provide mentorship and guidance to other analysts where necessary</li></ul>	NA	bhdLo_sBAx	Maryann	K.	Talent Acquisition Professional, Microsoft Dynamics, maryann@marval-us.com	NA	http://www.linkedin.com/jobs?viewJob=&jobId=3925016&trk=api*a225514*s233466*	Burlington, MA
3911395	RND00002291-en	True	2012	10	9	2012	12	8	1349759953000	1354943953000	1116	Procter & Gamble	RND - PhD - Statistician	us	Greater Boston Area	[{"code": "sci", "name": "Science"}, {"code": "rsch", "name": "Research"}]	[{"code": "25", "id": 25, "name": "Consumer Goods"}]	F	Full-time	2	Entry level	NA	NA	Provide statistical support for research and development of consumer products. Collaborate with researchers, engineers and other statisticians on efforts spanning the range from upstream design through consumer testing, production and commercial support. Deliver leading edge statistical methods to consumer, technical and quality research.<br><br>To learn more about this career path, click here.<br><br><strong>Learn more about doctoral level careers at P&amp;G via our new website </strong><strong> http://www.pgscience.com/ </strong><strong>.</strong><br><strong>Check out P&amp;G Doctoral Recruiting on Facebook and LinkedIn!</strong><br><br><strong>Qualifications</strong><br><ol><li>Provide statistical design support for consumer, laboratory and quality research. <li>Applying advanced statistical methods to analyze data from consumer, laboratory and quality research. <li>Enable researchers to understand and perform basic statistical analyses. <li>Identify best statistical practices both within and outside of the company and apply them in your work. <li>Collaborating with Statistical Computing group to deliver tools for automated data analysis. <li>Provide quantitative training to non-statisticians. <li>PhD in Statistics</li><br><br>Procter &amp; Gamble is an Equal Opportunity Employer. No immigration sponsorship is available for this position. Procter &amp; Gamble does not sponsor candidates for permanent residency except in some areas that in Procter &amp; Gamble's sole discretion require highly specialized backgrounds.<br><br>**Please include your resume and a brief summary of your research in the resume text field (maximum characters 64,000).**<br><br>Procter &amp; Gamble participates in e-verify as required by law.</li></li></li></li></li></li></ol>	NA	UyNsxjN1CU	Katie	R.	Associate HR Manager at Procter & Gamble	NA	http://www.linkedin.com/jobs?viewJob=&jobId=3911395&trk=api*a225514*s233466*	US-Massachusetts-Boston
3903977	22252	True	2012	10	8	2012	12	7	1349692037000	1354876037000	2751	Expedia	Lead Statistician, Retail Analysis	gb	London, United Kingdom	[{"code": "othr", "name": "Other"}]	[{"code": "4", "id": 4, "name": "Computer Software"}, {"code": "96", "id": 96, "name": "Information Technology and Services"}, {"code": "30", "id": 30, "name": "Leisure, Travel & Tourism"}]	F	Full-time	0	Not Applicable	NA	NA	Lead Statistician, Retail Analysis<br><br><strong>Job ID #:</strong> 22252<br><strong>Company</strong>: Expedia Affiliate Network<br><strong>Location</strong>: UK - London<br><strong>Functional Area</strong>: Business Analytics<br><strong>Employment Type</strong>: Full-Time Regular<br><strong>Education Required</strong>: Not Indicated<br><strong>Experience Required</strong>: Not Indicated<br><strong>Relocation Provided</strong>: To be determined<br><br><strong>Position Description<br><br></strong><strong>About EAN <br><br></strong>The online travel market never stands still. At Expedia Affiliate Network, were smack in the middle of it. Were an entrepreneurial start-up inside the worlds biggest travel company. We create the tools and technology that help millions of travellers find the perfect hotels for their next trips. As the worlds largest and fastest-growing affiliate network ( billion in sales and counting), we work with over 10,000 partners in 33 countries to turn their web traffic into hotel bookings and happy customers. We offer the chance to work with the brightest minds in the travel business in an energetic and international work environment focused on innovation, creative problem-solving and collaboration.<br><br><strong>Why build your career at EAN? <br><br></strong>Were re-inventing online travel, one day at a time - its an exciting challenge. Were super-motivated and setting the pace. Weve got the scope and the freedom to make a difference. We dont do ordinary. We work with some really smart partners - from search marketing whiz kids to the worlds leading airlines and travel agents. We make a positive impact on how the worlds travellers plan and book their perfect trip. 30,267 times a day, actually. Were a team of passionate, hard-working travel enthusiasts. We just love what we do. We define the questions, not the answers, for an industry that changes every day. Isnt that cool?<br><br><strong>Want to change the way the world travels? Come and join us! <br><br></strong><strong>Position Overview: <br><br></strong>The Revenue Optimisation group at Expedia Affiliate Network (EAN) is a new team responsible for identifying and driving significant revenue growth for the organization. The RO team is responsible for determining, via data analysis, how best to price and serve hotel inventory to EAN partners in order to maximise its profitability. You will work closely with other functions - product, technology, finance and customer operations - with the express goal of using advanced analytics to inform decision making and drive performance.<br><br>The <strong>Head of retail analysis</strong>reporting into the Director of Revenue Optimisation will be required to oversee the functioning of EANs hotel sort and pricing practices ensuring that results are in line with business objectives. The right candidate will need to have proven management experience as well as a broad experience of analytical techniques and advanced database technologies, and will be required to develop the teams into a leading and innovative unit of the company.<br><br><strong><br><strong>Qualifications</strong>: <br><br></strong>- Strong in applied analytics - uses empirical data to support decisions; ability to glean intelligence and behavioural inferences from data; demonstrable history of using data to drive incremental value<br><br>- Excellent organizational skills - this is a fast-paced operation in a high-growth phase, so its critical to be able to keep multiple balls in the air. A demonstrated ability to work collaboratively, as well as to manage workflow in accordance with project timelines is required.<br><br>- Curiosity - what are our competitors doing? How do our partners think? How do our products work?<br><br>- Communication - strong communication skills; must be able to communicate effectively with all levels of the organization, particularly with a non-technical audience<br><br>- Business acumen - strong business/commercial sense to combine with analytics to help drive recommendations; ability to navigate a P&amp;L and demonstrate an understanding of the commercial impact of their activities<br><br>- Problem solving - demonstrated ability to structure a large business problem into tractable components<br><br>- Autonomy - ability to work independently when required (in addition to collaboratively)<br><br><strong><strong>Work Experience and Education Guidelines</strong>: <br><br></strong>- Degree in Computer Science or a quantitative/numerate discipline such as Statistics, Mathematics or Quantitative Economics (Econometrics) required; PhD preferred<br><br>- Minimum 3 years' experience in a quantitative role<br><br>- Experience with two or more of following computing languages required: Java, Ruby, Python, HTML<br><br>- Knowledge of the following database technologies and languages required: Hive, Pig, SQL, Mongodb, Cassandra, Hadoop<br><br>- Knowledge of at least two of the following applications required: R, SAS, Stata, Tableau, Business Objects<br><br>- Demonstrated experience in some of the following disciplines: cluster analysis; market basket analysis; conjoined analysis; support vector machines; linear and non-linear regression; decision trees; genetic algorithms; Monte Carlo simulation; data visualisation<br><br>- Deep understanding of the following Economic concepts: diminishing returns, elasticity, utility curves and Nash equilibrium<br><br>About Expedia:<br><br>Our mission is to revolutionize travel through the power of technology.<br><br>Collectively, the Expedia brands cover virtually every aspect of researching, planning, and booking travel, from choosing the best airplane seat, to reading personal travel reviews of hotels, to planning what to do in a destination once you arrive. The Expedia portfolio serves both leisure and business travelers with tastes and budgets ranging from modest to luxury. Expedia delivers consumer travel demand from nearly every continent to nearly 149,000 hotels and hundreds of airlines, tour operators, car rental companies and destination services supply partners. Please visit http://bit.ly/expediabrands to learn more about our travel brands.<br><br>	NA	3O73x-AmRF	Jennifer	M.	Senior Recruiter-Expedia Affiliate Network at Expedia	NA	http://www.linkedin.com/jobs?viewJob=&jobId=3903977&trk=api*a225514*s233466*	London, UK
3732572	SAK-ResearchAnaStat-VA	True	2012	9	12	2012	12	11	1347449533000	1355225534000	21836	CyberCoders	Statistician - Statistician, SPSS, Secret Clearance	us	Washington D.C. Metro Area	[{"code": "it", "name": "Information Technology"}]	[{"code": "75", "id": 75, "name": "Government Administration"}]	F	Full-time	4	Mid-Senior level	NA	NA	Statistician - Statistician, SPSS, Secret Clearance We are in need of a Statistician with a degree in Business or Applied Mathematics. - Skills Required - Statistician, SPSS, Secret Clearance, Excel, Access, Sharepoint, .NET, Federal Government, Research Analyst, OE Specialist<br><br>We are in need of a Statistician with a degree in Business or Applied Mathematics.<br><br>If you are a Statistician with Research Analyst and Data Analyst experience, please read on! We offer a salary of $70-$82K plus benefits. Must have a secret clearance.<br><br>What you need for this position:<br><br>-Knowledge of and experience with managing documents, work products, and schedules using Sharepoint.<br>- Familiarity and comfortable using SPSS, Excel, Access, and other software as appropriate.<br>- Proficient with MS Office Tools (e.g., Outlook, Word, Excel, Project, PowerPoint)<br>- Proficient in setting up databases in Access.<br>-Secret clearance is required<br><br>What you'll be doing:<br><br>-Directly support the program manager and government client by collecting, parsing and interpreting program data.<br>- Coordinating with other consultants in development of dashboards, reports or other work products to display and convey the organization's support and impact to the department.<br>- Archiving deliverables, posting of finished products and uploading to the team Sharepoint site.<br>- Prepare and submit deliverables in accordance with contract specifications, with input from client-facing teams.<br>- Assist in the compilation and drafting of reports, concept papers and other collaborative work products, as required.<br>- Perform programming and analysis tasks using SPSS,  Excel, Access, and other software as appropriate.<br>-Prepares graphs and tables in Excel, Word, and other software as appropriate.<br>- Merges, modifies, and edits data files as needed for analysis or for use as sampling databases<br><br>What's in it for you:<br><br>-Good pay and benefits<br>-Good working environment<br>-Room for growth<br><br>So, if you are a Statistician with Research Analyst and Data Analyst experience, please apply today!<br><br>  <strong>Want to interview today? Click Here to Do a Quick 2-Minute Online Interview!</strong>  <p><strong>Are you a fit for this position?</strong></p>  <p>  <strong>Please Click Here to Apply!<br><br></strong>                                          http://www.CyberCoders.com/developer/profile/jobApply.aspx?jump=1&amp;menu=0&amp;ad=linkedinSusan.Karr&amp;posId=SAK-ResearchAnaStat-VA<br>  (your information will be kept strictly confidential!)  <br><br>  </p>  <p>Looking forward to receiving your resume through our website and going over the position with you. Clicking apply is the best way to apply, but you may also:</p>  <p>Email your resume in Word to:</p>  <p>Susan.Karr@CyberCoders.com<br>  **Please do NOT change the email subject line in any way. You must keep the JobID: linkedin : SAK-ResearchAnaStat-VA -- in the email subject line for your application to be considered.***  </p>  <p>Susan Karr - Executive Recruiter - CyberCoders</p>  <br><br><p>CyberCoders, Inc is proud to be an Equal Opportunity Employer.  Applicants are considered for all positions without regard to race, color, religion, sex, national origin, age, disability, sexual orientation, ancestry, marital or veteran status.</p>	NA	private	private	private	NA	NA	http://www.linkedin.com/jobs?viewJob=&jobId=3732572&trk=api*a225514*s233466*	Alexandria, VA
3575967	NA	True	2012	8	16	2012	12	14	1345112747000	1355480748000	1441	Google	Statistician/Engineering Analyst	gb	London, United Kingdom	[{"code": "rsch", "name": "Research"}, {"code": "eng", "name": "Engineering"}, {"code": "anls", "name": "Analyst"}]	[{"code": "84", "id": 84, "name": "Information Services"}, {"code": "6", "id": 6, "name": "Internet"}]	F	Full-time	0	Not Applicable	NA	NA	This position is based in London, UK.<br><br><strong>The area: Engineering &amp; Operations</strong><br><br>Google is and always will be an engineering company. We hire people with a broad set of technical skills who are ready to tackle some of technology's greatest challenges and make an impact on millions, if not billions, of users. At Google, engineers not only revolutionize search, they routinely work on massive scalability and storage solutions, large-scale applications and entirely new platforms for developers around the world. From AdWords to Chrome, Android to YouTube, Social to Local, Google engineers are changing the world one technological achievement after another.<br><br><strong>The role: Statistician/Engineering Analyst</strong><br><br>At Google, data drives all of our decision-making. Quantitative Analysts work all across the organization to help shape Google's business and technical strategies by processing, analyzing and interpreting huge data sets. Using analytical rigor and statistical methods, you mine through data to identify opportunities for Google and our clients to operate more efficiently, from enhancing advertising efficacy to network infrastructure optimization to studying user behavior. As an analyst, you do more than just crunch the numbers. You work with Engineers, Product Managers, Sales Associates and Marketing teams to adjust Google's practices according to your findings. Identifying the problem is only half the job; you also figure out the solution.<br><br><strong>Responsibilities:</strong> <li>Research, develop, and apply methods for measuring and analyzing Google products. <li>Develop new algorithms and methods for optimizing product performance, revenue, and adoption. <li>Research new ways for modeling and predicting end-user behavior. <li>Lead investigations into multiple streams of product data. <li>Design experiments to answer targeted questions. Conduct exploratory data analysis in high dimensions.<br><br><strong>Minimum qualifications:</strong> <li>BA/BS degree in Statistics or other quantitative disciplines such as Engineering, Applied Mathematics, etc. <li>Experience with large data sets using statistical software (R, S-Plus, Matlab, or similar) and large databases (SQL). <li>Ability to draw conclusions from data and recommend actions. Willingness to learn new techniques. <li>Excellent written and verbal presentation skills.<br><br><strong>Preferred qualifications:</strong> <li>MS or PhD in Statistics or other quantitative disciplines such as Engineering, Applied Mathematics, etc. <li>Broad work experience with large data sets. <li>Considerable practical experience in quantitative analysis. <li>Demonstrated leadership and self-direction. Strong experimental design and analysis skills. <li>Specific positions can benefit from experience in one or more of: Operations Research Online advertising, search, commerce Machine Learning Languages such as Python, JavaScript Forecasting, Time-series modeling Proficiency in foreign languages.</li></li></li></li></li></li></li></li></li></li></li></li></li></li>	NA	jP1pFREEpl	David	Z.	Technologist at Enigma Associates	NA	http://www.linkedin.com/jobs?viewJob=&jobId=3575967&trk=api*a225514*s233466*	London , United Kingdom
