id	customerJobCode	active	postingDate_year	postingDate_month	postingDate_day	expirationDate_year	expirationDate_month	expirationDate_day	postingTimestamp	expirationTimestamp	company_id	company_name	position_title	position_location_country_code	position_location_name	position_jobFunctions_values	position_industries_values	position_jobType_code	position_jobType_name	position_experienceLevel_code	position_experienceLevel_name	skillsAndExperience	descriptionSnippet	description	salary	jobPoster_id	jobPoster_firstName	jobPoster_lastName	jobPoster_headline	referralBonus	siteJobUrl	locationDescription
3917664	NA	True	2012	10	9	2013	1	7	1349801580000	1357577580000	148391	TalentMine	Statistical Programmer Analyst -  Clinical SAS	us	San Francisco Bay Area	[{"code": "othr", "name": "Other"}]	[{"code": "12", "id": 12, "name": "Biotechnology"}, {"code": "15", "id": 15, "name": "Pharmaceuticals"}]	C	Contract	4	Mid-Senior level	<p><strong>Required Skills -</strong> </p><p> </p><ul><li>MS in Statistics, Computer Science or related field. </li><li>Minimum of 5+ years in SAS Programming (3 in clinical). </li><li>Work experience with data manipulation, analysis and reporting. </li><li>Must have experience with Base SAS &amp; proc report. </li><li>Good knowledge of SAS/GRAPH and skilled with macros. </li><li>Good knowledge of SAS/STAT or other statistical software. </li><li>Experience with CDISC, SDTM/ADaM mapping. </li><li>Must be familiar with using and creating SAS macros. </li><li>Ability to interpret tabular and graphical clinical data presentations. </li></ul><p> </p><p><span style="text-decoration:underline">Should have actual work experience with the following:</span> <p></p></p><ul><li>Regression analysis, p-values, confidence intervals, advanced general linear models including repeated measures models, survival analysis, non-parametric analysis, randomization, and proficiency in implementing these ideas in clear, efficient SAS code. </li><li>Experience with some type of EDC and/or relational database theory. </li><li>Capable of clear and timely written and verbal communication with peers, customers, and management. </li><li>Able to give effective presentations to small groups such as project teams.</li></ul>	NA	<p><strong>About the position </strong> </p><p><strong></strong> </p><p>This is a contract position based in the Bay Area of California. This is an mid-senior position and will rely on solid programming techniques. This individual will assist in the development, validation and implementation of clinical trials. </p><p><strong></strong> </p><p><strong></strong> </p><p><strong>Duties -</strong> </p><p> </p><ul><li>Performs SAS Programming procedures in support of clinical trials, with adherence to industry standards. </li><li>Applies advanced level programming techniques with regard to monitoring, reporting and analysis of clinical trial data, and may also be involved with the planning, implementation, and maintenance of software used for such purposes. </li><li>Collaborates with project lead statistician to develop the statistical deliverables and meet project timelines. </li><li>Completes program development and documentation of data sets, tables, listings and graphs. </li><li>Participates in monitoring CRO deliverables/activities. </li><li>Conducts program verification and resolves technical problems. </li><li>Assists in the preparation/distribution of reports to the team. </li><li>Works closely with Biostatistics personnel to create analysis files specifications and analysis outputs per the SAP. </li><li>Contributes in the development, implementation and documentation of programming standards, templates/conventions &amp; CDISC standards. </li><li>Works with pre-clinical &amp; clinical research staff to plan and query results for global studies.</li></ul>	NA	QYy70DqWAk	Shawn	F.	Clinical Recruiter at TalentMine	NA	http://www.linkedin.com/jobs?viewJob=&jobId=3917664&trk=api*a225514*s233466*	San Francisco Bay Area
3893613	NA	True	2012	10	5	2012	12	4	1349436493000	1354620493000	1504694	PharmaNet/i3 Strategic Resourcing	Statistician	de	Berlin Area, Germany	[{"code": "anls", "name": "Analyst"}]	[{"code": "15", "id": 15, "name": "Pharmaceuticals"}]	F	Full-time	4	Mid-Senior level	<p>-To be eligible for consideration you will have a Statistical background and have worked as a Statistician or Statistical Programmer within a Pharmaceutical company or CRO, you should have experience with using SAS as an analytical tool and experience working within Medical Affairs would be an advantage. </p><p>-Candidates should have a minimum of a MSc in Statistics (or related) and be fluent in English,Germany language skills are preferred.</p>	NA	<p>Pharmanet i3 Strategic Resourcing are currently recruiting for an experienced Statistician for a contract position working within our operations in Germany.<br>  <br>The position is open to freelance contractors, but can also be offered as permanent employment.<br>  <br>Your role as a Statistician will primarily be to support Medical Affairs on a recently marketed product. You will support publications; drill data and answer queries; use Integrated Analysis combined studies database; work in close cooperation with Statisticians.</p>	NA	-PvHo3fkfB	Pharmanet/i3	S.	Recruiter at Pharmanet /i3 Strategic Resourcing	NA	http://www.linkedin.com/jobs?viewJob=&jobId=3893613&trk=api*a225514*s233466*	Berlin, or Home Based 
3696466	2000015046110	True	2012	9	6	2012	12	5	1346928997000	1354704997000	5911	Astellas Pharma	Associate Director, Biostatistics (Oncology)	us	Greater Chicago Area	[{"code": "rsch", "name": "Research"}, {"code": "sci", "name": "Science"}]	[{"code": "12", "id": 12, "name": "Biotechnology"}, {"code": "15", "id": 15, "name": "Pharmaceuticals"}, {"code": "70", "id": 70, "name": "Research"}]	F	Full-time	5	Director	NA	NA	Astellas is the bright spot in the pharmaceutical industry -- not just because of what we do, but in the way we do it. If you are looking for a company where you can change a life, make a dream come true, and light the way for a better tomorrow, Astellas is the place where you can shine. We offer a different kind of work culture. A high standard of ethics is mandatory. Quality is our pledge. Diversity is valued. Individual initiative is rewarded. Astellas offers an environment where our employees can make a real difference. Come, shine with us!<br><br>Astellas is announcing a Associate Director, Biostatistics opportunity in our Northbrook, IL location.<br><br>The Associate Director Biostatistics acts as fully independent global statistical lead (GSTATL), representing Data Science in Core Teams. He/she may be responsible for one or for multiple global or local drug projects within the same indication / therapeutic area. He/she leads large and/or complex projects, interacts with regulatory authorities and key opinion leaders, supervises other statisticians providing support to the projects and is accountable for the statistical soundness of ALL statistical input and deliverables for the assigned projects. Provides consultancy to other project teams and other GSTATLs in areas of expertise. He/she is expected to complete these tasks with very minimal supervision, appropriately and pro-actively seeking line management intervention where needed to ensure successful outcome, e.g. with respect to project resource requirements or key strategic functional issues.<br><br>Primary duties and responsibilities include:<br><br>*Participates in project teams for clinical development programs and/or lifecycle management of marketed products<br><br>*Provides strategic statistical input to the project teams and is a major contributor to the clinical development plan (CDP). Ensures CDP with statistical integrity and optimal study designs, and ensures that Data Science needs are reflected within the development plan and strategy across regions. Provides statistical advice to clinical teams including design of studies and analyses requiring advanced statistical methodologies. Recognises and addresses issues which may impact the statistical integrity of the development program or for which statistical tools may add value.<br><br>*Provides best in class data science support to Astellas drug development programs and leads the Data Science extended (project) team and deliverables teams. Ensures quality and consistency of key data science deliverables across studies. Ensures creation of, maintenance and adherence to indication specific standards with respect to key variables, definitions, statistical methods, data structures and presentation of results.<br><br>*Ensures availability of integrated database(s) where needed, and planning and conduct of integrated analyses to support development decisions, submissions or marketing needs.<br><br>*Represents the company on statistical matters at meetings with regulatory authorities, key opinion leaders and similar experts / bodies<br><br>*Reviews key project and study documents to ensure optimal statistical presentation and compliance. These documents include, but are not limited to, clinical development plans (CDPs), protocols, analysis plans, study reports, submission documents and correspondence with health authorities.<br><br>For studies within assigned projects:<br><br>*Provides all required statistical support and deliverables by supervising another statistician in that role, or as a member of study team him/herself.<br><br>*Writes or reviews key study documents to ensure optimal statistical presentation and compliance. These documents include, but are not limited to, protocols, analysis plans, tables, listings, and figure (TLF) specifications, study reports.<br><br>*Ensures efficient planning, execution and reporting of clinical studies and statistical review of critical documents such as CRFs, Data Validation Plans, SDTM/ADaM data specifications, TLFs<br><br>*Ensures statistical analyses performed in accordance with the protocol, statistical analysis plan, good statistical practice, and available regulatory guidelines.<br><br>*Provides (executive) topline reports of study results<br><br>When statistical support or SAS programming for studies or other deliverables within assigned projects are contracted out to a CRO:<br><br>*In consultation with functional management, selects vendors.<br><br>Performs vendor oversight for assigned programs:<br><br>*Ensures CRO provided with details, timelines and Astellas specifications and requirements and kept updated in case of changes. Monitors timelines, progress and specific issues, and takes action if necessary.<br><br>*Ensures review of the outputs created by the CRO.<br><br>Other tasks and roles may include:<br><br>*Major contributor to cross-departmental/departmental/sectional improvement initiatives, for example: write SOPs; select, validate and implement statistical software; generate standard output or analysis methods.<br><br>*Member or leader of external industry or professional organizations. Develops and maintain relations with leading academic institutions.<br><br>*Perform vendor qualification / audits in collaboration with functional management<br><br>*Investigates new statistical methodology and feeds back to department and project teams<br><br>*Participates in due diligence activities, reviews data and advises company.<br><br>The Data Science department provides statistical, biometrical and data management/warehousing expertise for all R&amp;D projects and marketed products, encompassing Phase I-IV studies. Qualified biostatistical expertise for clinical studies and drug submissions is a regulatory requirement, and carried out in accordance with international regulations (ICH, FDA, EMA) and internal Astellas SOPs and standards. The results must be reproducible and statistically sound, and are subject to internal and external inspections. Flawed statistical input to drug development projects may result in failure to achieve marketing authorization or regulatory approval delays resulting in substantial financial loss for the company.<br><br>Approximately, an Associate Director is assigned to 1-6 compounds simultaneously in 1-3 indications, and oversees between 4 and 12 studies simultaneously. He/she undertakes this work with minimal supervision.<br><br>There are 5 biostatistician levels (excluding functional management roles). This is the fourth level. Reports to Associate Director / Director Biostatistics. Is a member of project teams. Closely collaborates with project team members (e.g. project leader, development operations lead, medical lead, regulatory affairs, clinical pharmacology, project management). Leads the data science extended (project) team and deliverables teams. Is a member of study teams and/or supervises other statisticians as members of study teams for studies within assigned projects. Manages to achieve successful outcome through delegation of work, coaches assigned team members within own functions. Provides guidance to / mentors less experienced statisticians.<br><br>*M.S. or Ph.D. in statistics or equivalent<br><br>*Minimum of 8 years experience in applying statistical methods in biomedical research, extensive pharmaceutical or CRO experience required<br><br>*Knowledge and skills in SAS required and knowledge of other statistical software preferred.<br><br>*In-depth familiarity with processes and procedures in data management and SAS programming<br><br>*Experience in working on clinical project teams. Good understanding of entire drug development process - ability to see the "big picture".<br><br>*Experience with cross functional process improvement or innovation initiatives<br><br>*Advanced and broad knowledge of statistical methods, along with understanding of industry practices related to the statistical analysis of clinical data<br><br>*Experience working in an international environment and demonstrated ability to manage and influence across different locations, time zones and cultures; builds global relationships.<br><br>*Ability to work in a matrix environment.<br><br>*Proven excellent organizational, project and time management skills.<br><br>*Leadership skills and ability to delegate appropriately and provide direction to more junior Biostatisticians.<br><br>*Very good oral, written, and presentation communication skills. Able to clearly communicate statistical issues and methods to both statisticians and non-statisticians.<br><br>*Very good problem solving skills.<br><br>*Accurate with a keen eye for detail. Dedication to quality and reliability in all work tasks<br><br>*Ability to perform under pressure<br><br>Desired Qualifications:<br><br>*2+ years experience in Oncology<br><br>*Experience as the independent lead statistician in a regulatory submission preferred<br><br>*cb*<br><br>	NA	HS6UWsHfBE	Christina	S.	Client Relationship Manager at The Right Thing, Inc., an ADP Company	NA	http://www.linkedin.com/jobs?viewJob=&jobId=3696466&trk=api*a225514*s233466*	Northbrook, IL
3203285	NA	True	2012	6	14	2012	12	11	1339666758000	1355218758000	1441	Google	Statistician/Engineering Analyst	us	San Francisco Bay Area	[{"code": "rsch", "name": "Research"}, {"code": "eng", "name": "Engineering"}, {"code": "anls", "name": "Analyst"}]	[{"code": "84", "id": 84, "name": "Information Services"}, {"code": "6", "id": 6, "name": "Internet"}]	F	Full-time	0	Not Applicable	NA	NA	This position is based in Mountain View, CA.<br><br><strong>The area: Engineering and Operations</strong><br><br>Google is and always will be an engineering company. We hire people with a broad set of technical skills who are ready to tackle some of technology's greatest challenges and make an impact on millions, if not billions, of users. At Google, engineers not only revolutionize search, they routinely work on massive scalability and storage solutions, large-scale applications and entirely new platforms for developers around the world. From AdWords to Chrome, Android to YouTube, Social to Local, Google engineers are changing the world one technological achievement after another.<br><br><strong>The role: Statistician/Engineering Analyst - Mountain View</strong><br><br>As a Statistician/Engineering Analyst, you will evaluate and improve Google's products, such as Ads and Search. You will collaborate with a multi-disciplinary team of engineers and analysts on a wide range of problems. This position will bring analytical rigor and statistical methods to the challenges of measuring Search and Ads quality, improving consumer products, and understanding the behavior of end-users, advertisers, and publishers.<br><br>Please note that this position is the same as Data Scientist.<br><br><strong>Responsibilities:</strong> <li>Research, develop, and apply methods for measuring and analyzing Google products. <li>Develop new algorithms and methods for optimizing product performance, revenue, and adoption. <li>Research new ways for modeling and predicting end-user behavior. <li>Lead investigations into multiple streams of product data. <li>Design experiments to answer targeted questions. Conduct exploratory data analysis in high dimensions.<br><br><strong>Minimum qualifications:</strong> <li>BA/BS degree in Statistics or other quantitative disciplines such as Engineering, Applied Mathematics, etc. In lieu of education, 4 years of relevant experience. <li>Experience with large data sets using statistical software (R, S-Plus, Matlab, or similar) and large databases (SQL). <li>Ability to draw conclusions from data and recommend actions. <li>Willingness to learn new techniques. Excellent written and verbal presentation skills.<br><br><strong>Preferred qualifications:</strong> <li>MS or PhD in Statistics or other quantitative disciplines such as Engineering, Applied Mathematics, etc. <li>Broad work experience with large data sets. <li>Considerable practical experience in quantitative analysis. <li>Demonstrated leadership and self-direction. <li>Strong experimental design and analysis skills. <li>Specific positions can benefit from experience in one or more of: Operations Research, Online advertising, search, commerce, Machine Learning, Languages such as Python, JavaScript, Forecasting, Time-series modeling and Proficiency in foreign languages.</li></li></li></li></li></li></li></li></li></li></li></li></li></li></li>	NA	jP1pFREEpl	David	Z.	Technologist at Enigma Associates	NA	http://www.linkedin.com/jobs?viewJob=&jobId=3203285&trk=api*a225514*s233466*	Mountain View, CA
4046830	NA	True	2012	10	26	2012	11	25	1351292551000	1353884551000	1007791	Reunify	Analytics Research Engineer- Statistician	us	Greater Los Angeles Area	[{"code": "eng", "name": "Engineering"}]	[{"code": "4", "id": 4, "name": "Computer Software"}, {"code": "97", "id": 97, "name": "Market Research"}]	F	Full-time	0	Not Applicable	<p><strong>Preferred Experience and Skills</strong> <p></p></p><ul><li>MS or PhD in Computer Science or closely related disciplines </li><li>Strong working knowledge of data mining, machine learning and graph related algorithms such as generative models, clustering (e.g. LDA, SVM), classification (e.g. decision tree, Bayesian, HMM ), Multivariate Regression and Logistic Regression </li><li>Working knowledge of R, Matlab </li><li>One or more scripting languages </li><li>Large-scale system design experience with extensive knowledge of Unix/Linux </li><li>Familiarity with database design with a working knowledge of MySQL </li><li>Excellent understanding of computer science fundamentals, data structures and algorithms </li><li>Ability to work under aggressive deadlines </li><li>Superior analytical and influential skills, attention to detail, and exceptional creativity with the ability to balance in a resource constrained environment </li><li>Knowledge of consumer profiling and modeling </li><li>Expert knowledge of online/offline marketing metrics and direct marketing channels </li><li>Solid track record of successfully understanding the needs of the client and developing relationships that lead to long-term partnership </li><li>Must possess excellent communication and organizations skills with the ability to work within a fast paced company with increasing needs </li><li>Ability to draw conclusions from data and recommend action </li></ul><ul><li><strong>Desired Experience and Skills (any of the following would be a plus) :</strong> </li></ul><ul><li>Background in NoSql technologies such as Hadoop and Mapreduce </li><li>Background in NLP and Information Extraction from unstructured data </li><li>Knowledge of C/C++, Java or Python </li><li>Knowledge of SAS or SPSS </li></ul><p><br></p>	NA	<ul><li>Design and develop creative, advanced scalable solutions for mining terabytes of data </li><li>Design and develop state of the art optimization and randomization techniques </li><li>Research, develop, and apply methods for measuring and analyzing Reunify products </li><li>Develop new algorithms and methods for optimizing product performance, revenue, and adoption </li><li>Research new ways for modeling and predicting end-user behavior </li><li>Design experiments to answer targeted questions, conduct exploratory data analysis in high dimensions</li></ul>	Competitive Compensation & Benefits 	nO8GpbRIeG	Soodi	E.	Talent Acquisition Manager	NA	http://www.linkedin.com/jobs?viewJob=&jobId=4046830&trk=api*a225514*s233466*	Santa Monica, California
4044089	NA	True	2012	10	26	2012	11	25	1351268380000	1353860381000	54788	Clark Davis Associates	Associate Director Biostatistics	us	Greater New York City Area	[{"code": "othr", "name": "Other"}]	[{"code": "15", "id": 15, "name": "Pharmaceuticals"}]	F	Full-time	5	Director	<p>-At least5 years of pharmaceutical clinical trial experience <br>-Oncology experiencestrongly preferredwith Ph.D. in Biostatistics or statistics <br>-Familiar with clinical trial Phase I-III study design and survival analysis; <br>-Regulatory submission experience will be a plus. <br>-Strong programming skills in SAS. <br>-Familiar with statistical software such as EaSt, nQuery, Splus and others. <br>-Strong interpersonal and communication skills. <br>-Able to handle multiple projects concurrently and tight timelines. <br>-Experience with managing CRO and consultants will be a plus.</p>	NA	<p>Serveas a lead biostatistician for clinical studies and projects, accountable for all statistics related activities <br>throughout drug development from study design to regulatory filings and publications. <br><br>Responsibilities <br>-Working as study and/or project statistician, will contribute to clinical trial design, protocol concept sheet and protocol development. <br>-Participate study related activities and provide statistical support such as reviewing Case Report Form (CRF) and guidance, validating randomization scheme, Review Committee Charter and data transfer plan. <br>-Develop and review statistical documents and deliverables for clinical trials including Statistical Analysis Plan (SAP) for individual studies and integrated summaries of drug efficacy and safety, Table, Listing and Graph (TLG) shells, Data Monitoring Committee Charter and interim analysis plan, Clinical Study Report (CSR) and others. <br>-Managing biostatistics team, including junior statistician, contract statistician and programming team in support of biostatistics operational activities, including input on department budget, resource planning and identification, and timeline setting for responsible <br>projects and studies. </p><p>-Working as biostatistics function representative in clinical projects, and studies. Attend project and study team meetings as <br>needed. </p><p>-Contribute functional timelines to global project. </p><p>-Support and participate activities related to regulatory requests and meetings as needed. <br>-Provide statistical expertise by identifying potential issues, providing recommendations and bring in statistical experts internal or external for relevant issues as needed. <br>-Involve process initiatives and improvements.</p>	Up to $150,000 +20% bonus + relocation 	u5PpDC3f0r	Darren	G.	Director, Clark Davis Associates, dgutowski@clarkdavis.com	NA	http://www.linkedin.com/jobs?viewJob=&jobId=4044089&trk=api*a225514*s233466*	Greater New York City Area
