id	customerJobCode	active	postingDate_year	postingDate_month	postingDate_day	expirationDate_year	expirationDate_month	expirationDate_day	postingTimestamp	expirationTimestamp	company_id	company_name	position_title	position_location_country_code	position_location_name	position_jobFunctions_values	position_industries_values	position_jobType_code	position_jobType_name	position_experienceLevel_code	position_experienceLevel_name	skillsAndExperience	descriptionSnippet	description	salary	jobPoster_id	jobPoster_firstName	jobPoster_lastName	jobPoster_headline	referralBonus	siteJobUrl	locationDescription
4148757	NA	True	2012	11	9	2012	12	9	1352495668000	1355087676000	96851	Trepp, LLC	Senior Statistician/Analyst	us	Greater New York City Area	[{"code": "it", "name": "Information Technology"}]	[{"code": "43", "id": 43, "name": "Financial Services"}]	F	Full-time	3	Associate	<p>Candidates should have a masters or Ph.D. in Statistics, Mathematics, or a closely related field. (Ph.d students are welcome to apply. Will also consider candidates that must work remotely and those with current academic positions). Industry experience in quantitative risk modeling is a plus as is knowledge of the banking industry and stress testing. Ability to communicate technical subject matter clearly (both verbally and in written form) and concisely to individuals from various backgrounds is important. <p></p></p><p>Keywords: forecaster, forecasting, statistician, statistics, analytics, analyst, analysis, economics, econometrician, econometrics, modeling, segmentation, multivariate, time series.</p>	NA	<p><strong>Job Summary:<br> </strong><br> Applicant will advance existing, internally-developed models that support the U.S. banking industry. Applicant will mine historical databases toimprove model correlations, maintain models as regulatory guidance  evolves, and perform extensive backtesting. Applicant will also contributeto the write-up and review of the statistical methods description, presentations, and analysis documents as needed. </p><p> </p><p><strong>About the Job</strong> </p><ul><li>Bepart of the growing team of a vibrant data and analytics company, with a client base that includes investment banks, commercial banks, hedgefunds, money managers, insurance companies, regulators, and rating agencies. </li><li>Working with senior staff, the applicant is expected to help advance Trepps credit model for banks including maintaining and improving the model; performingadvanced backtesting; and creating documentation of model results. </li><li>Apply a wide variety of advanced statistical, mathematical, and financial techniques to complicated processes for modeling, forecasting, and othercomplex analytical problems.  </li><li>Employ statistical, financial, and analytic knowledge to develop relevant  correlations for banks against macroeconomic variables such as GDP,unemployment rates, interest rates, etc. </li><li>Use statistical techniques (e.g., clustering or other multivariate) to advance themodel. </li><li>Develop and execute forecasting models (regression, time series,etc.) for bank performance under a host of different economic scenarios. </li><li>Utilizedata management and computer literacy skills (including SAS or similar programs) to manipulate large data sets for database extraction, reporting, and model development. </li><li>Work in a fast paced environment applying strong sense of time urgency and theability to handle tight project timelines as needed.</li></ul>	NA	pdoYASqWSW	Cheryl (Smith)	S.	VP, Human Resources at Trepp, LLC	NA	http://www.linkedin.com/jobs?viewJob=&jobId=4148757&trk=api*a225514*s233466*	Greater New York City Area
4142213	1454320	True	2012	11	9	2012	12	9	1352458453000	1355050453000	1012623	Real Staffing Group	12 month senior-level statistical programmer  Cambridge Ma	us	Greater Boston Area	[{"code": "sci", "name": "Science"}, {"code": "rsch", "name": "Research"}, {"code": "qa", "name": "Quality Assurance"}]	[{"code": "12", "id": 12, "name": "Biotechnology"}, {"code": "15", "id": 15, "name": "Pharmaceuticals"}, {"code": "17", "id": 17, "name": "Medical Devices"}]	C	Contract	0	Not Applicable	NA	NA	My large Pharmaceutical client based in Cambridge has an immediate need for a SAS programmer with excellent communication and strategic thinking to join their team for an initial 12 month contract.<br><br>Role<br><br>You must be able to demonstrate good critical thinking, excellent SAS skills and good communication due to working with global staff. The ideal candidate will be a multi-tasker with experienced of clinical trials data analysis, working within bounds of established company practices. This role would suit someone who has solid SAS programming experience but also a background with leading projects or liaising with multiple departments in their previous roles.<br><br>You will be involved with the analysis and reporting of clinical trials data  tables/figures/listings.  The ideal candidate will be based in the Boston area and willing to commute to Cambridge for meetings with sr managers and statisticians/clinical team, and after a period home working will be an option.<br><br>Essential Skills:<br><br>5+ years SAS Programming experience <br>Excellent Communication / strategic thinking<br>Bachelors degree in related subject.<br><br>Beneficial skills:<br><br>Background in large pharmaceutical and academic clinical trials work. <br>Bright thinker able to draw connections between various things and contribute to meaningful discussions with statistician.<br><br><br><br>(Real Staffing Group acts as an Employment Agency and an Employment Business)	NA	0LLhZ_akiB	Nikki	H.	Media Strategy Manager at Sthree	NA	http://www.linkedin.com/jobs?viewJob=&jobId=4142213&trk=api*a225514*s233466*	Boston, MA
4139872	1200000842	True	2012	11	9	2012	12	9	1352437063000	1355029063000	5742	ICF International	Survey Sampling Statistician - International Health	us	Washington D.C. Metro Area	[{"code": "rsch", "name": "Research"}, {"code": "cnsl", "name": "Consulting"}]	[{"code": "70", "id": 70, "name": "Research"}]	F	Full-time	4	Mid-Senior level	<p><strong>Basic Qualifications:</strong> </p><ul><li>Masters Degree inStatistics or similar discipline </li><li>Related expertiseincluding demonstrated experience in survey sample designin international settings </li><li>Demonstrated skills in designing samples for household and/or facility surveys, calculating weights for survey data, and calculating sampling errors </li><li>Familiarity with a wide range of advanced statistical techniques </li><li>Demonstrated experience in international health and development </li><li>Experience in developing sampling capacity of counterparts in host counties. </li></ul><p> <strong>Preferred Qualifications:</strong> </p><ul><li>PhD in Statistics or similar discipline </li><li>Fluency in French, Spanish or Arabic, in addition to English, is a plus. </li></ul><p> ICF offers an excellent benefits package, an award winning talent development program, and fosters a highly skilled, energized and empowered workforce.<br> <br>ICF International is an Equal Opportunity and Affirmative Action Employer - M/F/D/V  Please apply at: https://icfi.taleo.net/careersection/icf_prof_ext/jobdetail.ftl?lang=en&amp;job=1200000842 For a listing of other career opportunities at ICF, please visit our Career Center at www.icfi.com/careers/</p>	NA	<p><strong>International Survey Sampling Statistician</strong>  (Job Number:1200000842)  Description Health, Education &amp; Social Programs Group International Health and Development Division Survey Sampling Statistician Calverton, MDICFs International Health and Development (IHD) Division is growing and seeks a Survey Sampling Statistician with international experience to work in our Calverton, Maryland office. Our division supports population-based surveys, monitoring and evaluation projects, such as the USAID DHS Measure project and other research in a wide range of content areas including maternal and child health, vulnerable populations, demographics, family planning, HIV/AIDS, TB, Malaria, nutrition, food safety, and climate change. Our work focuses on important policy issues for developing countries in Africa, Asia and Latin America. We use rigorous and innovative evaluation methods, and partner closely with our clients and others to ensure that results are relevant, useful and make a difference. The data is used by all internationally focused national government donor agencies and USAID. You will work on a variety of projects and have an excellent opportunity for growth alongside recognised experts in the field. This is a full-time position, and 25% international travel is expected (International trips are typically 1-2 weeks at a time)Responsibilities of the Survey Sampling Statistician include: </p><ul><li>Developing sample designs for household and facility surveys and other types of research studies in developing countries </li><li>Calculating weights for sample survey data and estimating sampling errors </li><li>Providing technical assistance and training in sampling frame construction, sample design, sample size calculations, stratification, sample selection and weighting </li><li>Preparing descriptions of sampling procedures for project reports </li><li>Providing statistical advice to the staff in the IHD Division.</li></ul>	NA	CUfhP7fdOF	Jamila	W.	Sr. Recruiter at ICF International	NA	http://www.linkedin.com/jobs?viewJob=&jobId=4139872&trk=api*a225514*s233466*	Calverton, Maryland, US
4137410	12-0220	True	2012	11	8	2012	12	8	1352398941000	1354990941000	11647	BioMarin	Biostatistician/Senior Biostatistician	us	San Francisco Bay Area	[{"code": "othr", "name": "Other"}]	[{"code": "12", "id": 12, "name": "Biotechnology"}, {"code": "15", "id": 15, "name": "Pharmaceuticals"}]	F	Full-time	4	Mid-Senior level	<p>EDUCATION </p><p> </p><p>Minimum educational degree is an MS in Statistics, Biostatistics, or Biometrics. <br>Preferred educational degree is a Ph.D in the same areas described above. </p><p><br>EXPERIENCE </p><p> </p><p>A minimum of 3 years for Ph.D (5 years for MS) working experience in pharmaceutical and/or Biotech Company. <br>Must be knowledgeable of statistical methods in clinical data analyses (from Phase I through Phase IV), including statistical procedures in analysis software (e.g., SAS), and regulatory regulations/guidelines. <br>Must be knowledgeable of CDISC requirements for SDTM and ADaM<br> Preferred to have worked on electronic NDA and/or BLA submissions via e-CTD. </p><p><strong>To apply: <strong>http://tinyurl.com/atayku9</strong></strong></p>	NA	<p>Our Biometrics group is looking for a skilled statistician with training and experience in statistics, drug development, and clinical research. This person will provide biostatistics leadership and oversight for all phases of clinical trials and drug development programs, including regulatory submissions. This individual is also responsible for production of biostatistics deliverables, such as statistical analysis plan and programming specifications in preparing a clinical study report (CSR) or publication. </p><p> </p><p>RESPONSIBILITIES </p><p> </p><p>Participate in new drug development programs as a Subject Matter Expert (SME) in statistics area. <br>Keeps abreast of literature/advancements in science/medicine/technology in own and related fields of the drug development program.<br> Collaborates with clinical scientists, clinical operations, medical writers, clinical data managers , and statistical programmers in developing a clinical study protocol, case report forms (CRFs), and edit checks. <br>Provides a sample size based on the specification provided by clinical scientists. <br>Develops a statistical analysis plan for a clinical study or publication. <br>Develops analysis specifications for Statistical Programmer and reviews/verifies analyses and programming codes for quality assurance. <br>Participates in development of standard reporting programs for clinical studies. <br>Participates in development of standard CRFs for clinical data collection. <br>Participates in regulatory submissions including CSR, IND safety update, Annual Report/PSUR, and integrated summaries of safety and efficacy in NDA and BLA <br>Ensures the quality of data and accuracy of analyses in regulatory submissions (e.g., CSR) or publications. <br>Develops SOPs, guidelines, and template. </p><p> </p><p><strong>To apply: <strong>http://tinyurl.com/atayku9</strong></strong></p>	NA	55Fp_8q4xK	Yvonne	G.	Senior Recruiter at BioMarin	NA	http://www.linkedin.com/jobs?viewJob=&jobId=4137410&trk=api*a225514*s233466*	San Francisco Bay Area
4133197	564649	True	2012	11	8	2012	12	8	1352385274000	1354977274000	NA	PepsiCo	R&D Senior Principal Statistician	us	Dallas/Fort Worth Area	[{"code": "rsch", "name": "Research"}]	[{"code": "137", "id": 137, "name": "Human Resources"}]	F	Full-time	2	Entry level	NA	NA	Lead R&amp;D statistical analysis, design of experiment and modeling across new product development, quality, productivity and other R&amp;D functions. Develop new analysis methods, tools and build overall organizational statistical capabilities. Coordinate overall intern and new hire statistical analysis and training. Qualifications:<br><br> <br><ul><br><li>PhD in Statistics<br></li><li>Minimum 8 years of related industrial experience in statistical analysis, design of experiment and/or modeling<br></li><li>Working knowledge of Bayesian Statistics, Minitab and R<br></li><li>BS in ChemE or ME a plus<br></li><li>Above average leadership skills in communication, analytical problem solving, teamwork and drive for results<br></li><li>Must be willing and able to travel 5% of the time<br></li></ul><br><br>Equal Opportunity Employment M/F/D/V <br><br>Ref: 10049BR	NA	jP1pFREEpl	David	Z.	Technologist at Enigma Associates	NA	http://www.linkedin.com/jobs?viewJob=&jobId=4133197&trk=api*a225514*s233466*	US -Texas- Plano
4132190	563932	True	2012	11	8	2012	12	8	1352384069000	1354976070000	NA	Syngenta	Statistician Job	us	Des Moines, Iowa Area	[{"code": "rsch", "name": "Research"}]	[{"code": "137", "id": 137, "name": "Human Resources"}]	F	Full-time	2	Entry level	NA	NA	<strong>Division: </strong> R&amp;D (Crops)<br><strong>Function: </strong> Bioinformatics<br><strong>City: </strong> Slater<br><strong>State/Province: </strong> Iowa [IA]<br><strong>Country: </strong> United States [US]<br><strong>Position Title: </strong> Statistician<br><strong>Job ID: </strong> 3332<br><br><strong>Role Purpose/Accountabilities: <br></strong> Role Purpose:<br><br>To provide high quality, high level and business-relevant statistical service and consultation to individuals, workgroups and projects within the global seeds field research area. This role will be part a Statistical Support Team which will support North and South American based seeds (and related) R&amp;D projects and programs in the design and analysis of experiments, statistics consulting, and education. The expected outcomes include improved project quality/outcomes and increased insights into project/function that enables continuous improvement.<br><br><strong>Accountabilities: <br></strong>- Provide routine and non-routine statistical analyses using standard statistical software (SAS, JMP, R) in coordination with the Senior Statistician and Statistical Support team.<br>- Provide specialist advice on the design and conduct of experiments such that company resources are used optimally, ensuring that experiments stand a good chance of meeting their objectives using the minimum of resource.<br>- Provide statistical analysis and/or guidance in the interpretation of results for individuals and projects, where such work is likely to add significant value to the business.<br>- Support data reviews that enable the development of data and program design quality metrics to achieve continuous improvement in our R&amp;D projects, functions and programs.<br>- Encourage and enable field R&amp;D staff within seeds (and related) to satisfy their own routine statistical analysis requirements by assisting in implementing suitable software, and providing training and support for statistical software and general statistics knowledge.<br>- Work with crop data managers and others in the Statistical Support team to advise/assist in database construction to allow scientists, researchers, and statisticians to utilize data for statistical analyses.<br>- Provide statistical computing expertise for RDIS projects needing Statistical Support team input.<br>- Serve as a fully engaged and contributing member of the Syngenta R&amp;D Statistical Network Invest in personal and professional development.<br>- Invest in personal and professional development.<br><br><strong>Knowledge, Skills &amp; Experience: </strong><br><br><strong>Critical knowledge: </strong>:<br><br>- Strong communication, engagement and stakeholder management capabilities.<br>- Project management experience preferred.<br>- Ph.D. in Statistics or equivalent training and experience base (5-6 years experience in statistical consulting or PhD in Plant Breeding or Genetics with 2 years).<br>- Knowledge of applied research methods, designs and statistical tools used in plant genetics, traits, and plant breeding across crops, including background in use of molecular markers and genetic information. Requires ability to work with sophisticated software and information management tools and large datasets.<br>- Strong verbal and written communication skills in English and a proven ability to work well in a team environment are required.<br>- Requires an interest, ability, and desire to familiarize and understand field activity in breeding nurseries and field plot evaluation in global breeding programs and winter off-season fields. Some local overnight travel and international travel is required.<br>- Problem Solving Skills: Ability to collaborate with researchers and research teams in the identification and solving of experimental design, analysis and optimization challenges. Requires knowledge of both theoretical and practical components of genetics, statistics, and plant breeding.<br>- Decision Making Skills: Ability to apply new technologies to understand and evaluate advantages to incorporating into research projects and breeding programs<br><br>Critical experience:<br><br>- Minimum of 5 years of research experience or equivalent amounts of relevant education and experience.<br>- Experience with quantitative/population genetics and use of conventional and marker assist strategies in crop improvement breeding programs.<br>- Strong self-motivation with capabilities to initiate projects, make decisions and solve problems.<br>- Excellent personal interaction skills required for effectively developing strong internal and external working relationships with a diverse group of people<br><br>Critical technical, professional &amp; personal capabilities:<br><br>- Excellent mathematical/statistical problem solving skills.<br>- Computer programming expertise.<br>- Teaching and coaching skills.<br>- Building strategic relationships.<br>- Ability to work in teams<br><br>Critical leadership capabilities:<br><br>- Develops people, organization and self.<br>- Communicates with impact.<br>- Builds a culture of innovation.<br>- Collaborates across boundaries.<br><strong>Critical Success Factors &amp; Key Challenges: </strong> <br>- Be part of the Statistical Support function as a valued collaborator and key resource for our R&amp;D functions and projects.<br>- Promote statistical measures that underpin and feed into the germplasm program metrics.<br>- Help develop statistical competency across the R&amp;D community and assist in building resources and tools that optimize outcome and efficiency of our efforts in this area.<br>- Become a go-to person for statistical analyses for Seeds field R&amp;D staff, germplasm excellence special requests, and general R&amp;D scientists' statistics questions.<br><br><strong>Additional Information: </strong><br><br>- All applicants must be eligible to work in the US.<br>- Requires significant travel<br>- Requires extensive use of teleconferencing and working across diverse cultures, competency groups and organizational structures	NA	jP1pFREEpl	David	Z.	Technologist at Enigma Associates	NA	http://www.linkedin.com/jobs?viewJob=&jobId=4132190&trk=api*a225514*s233466*	US -Iowa- Slater
