id	customerJobCode	active	postingDate_year	postingDate_month	postingDate_day	expirationDate_year	expirationDate_month	expirationDate_day	postingTimestamp	expirationTimestamp	company_id	company_name	position_title	position_location_country_code	position_location_name	position_jobFunctions_values	position_industries_values	position_jobType_code	position_jobType_name	position_experienceLevel_code	position_experienceLevel_name	skillsAndExperience	descriptionSnippet	description	salary	jobPoster_id	jobPoster_firstName	jobPoster_lastName	jobPoster_headline	referralBonus	siteJobUrl	locationDescription
4170785	NA	True	2012	11	13	2012	12	13	1352849125000	1355441129000	12890	Cabela's	Marketing Statistician	us	Greater Denver Area	[{"code": "rsch", "name": "Research"}]	[{"code": "27", "id": 27, "name": "Retail"}]	F	Full-time	4	Mid-Senior level	<ul><li>This individual will lead the formulation and execution of advanced analytics for marketing campaigns across the catalog, internet, and retail channels to drive sales across channels. </li><li>Provide technical expertise to non-technical audiences with the ability to explain the results of analytic output to these audiences using the appropriate media, including, but not limited to the use of GIS mapping software to provide high-impact results that influence management decisions. </li><li>Actively participate in cross-department teams, providing analytical expertise, offering unique perspectives, and challenging the status quo to deliver actionable strategies that address business objectives. </li><li>Innovate and implement ideas that reduce manually intensive operations and increase the efficiency of the statistical team. </li><li>Monitor and evaluate trends and innovations within statistical methodologies and determine how they can be applied to the market research department to improve modeling results. </li><li>Provide statistical guidance to other members of the marketing department to address questions that arise from surveys, campaign testing, and other marketing analysis projects. </li><li>Apply a variety of advanced statistical modeling techniques to develop marketing insights, recommendations, and hypotheses. </li><li>Develop organizational and project management skills to manage multiple, complex analytical projects, determining and allocating resources to complete within scheduled timeframes. </li></ul><p> </p><p><strong>Education &amp; Experience:</strong> </p><ul><li>Master's Degree preferred OR </li><li>Bachelor's degree with 5 - 10 years experience </li></ul><p></p>	NA	<p>If you have a passion for the outdoors and a desire to work for the biggest name in the industry, then Cabelas, the Worlds Foremost Outfitter of Hunting, Fishing and Outdoor Gear, may have the job for you. Were you Born to Work Here? Cabelas has an opening for a <strong>Marketing Statistician in the Analytics, Data &amp;SciencesDepartment</strong> at our corporate office in Sidney, NE.<br> <br>Lead the development and research of advanced analytic processes to support marketing strategies, retail site selection, and product optimization across the multi-channel business model. Accountable for the integrity, accuracy, and timely execution of these processes to provide data-driven insights to management to make more informed decisions. </p><p> </p><p><strong>Cabelas is an Equal Opportunity Employer (EOE) and we seek to create an inclusive work place that embraces diverse backgrounds, life experiences and perspectives.</strong><br> <br><strong>Cabela's offers a competitive benefits package to include: 401k, vacation, profit sharing, health and dental coverage for you and your family, relocation assistance, and employee discounts.</strong></p>	NA	Of79-LWHlD	Andrea	T.	Corporate Recruiter at Cabela's	NA	http://www.linkedin.com/jobs?viewJob=&jobId=4170785&trk=api*a225514*s233466*	Sidney, NE
4169494	NA	True	2012	11	13	2012	12	13	1352838713000	1355430714000	98704	Analytic Recruiting	Marketing Statistician/Decision Scientist	us	Greater New York City Area	[{"code": "advr", "name": "Advertising"}]	[{"code": "80", "id": 80, "name": "Marketing and Advertising"}]	F	Full-time	4	Mid-Senior level	<ul><li>Masters Degree in Statistics, Operations Research, Economics, Social Sciences or similar degree with a focus on statistical methodology. PhD preferred. </li><li>Proven track record in advanced marketing analytics with a consulting firm, agency or on client side (marketing/media) strongly preferred, with 8+ years experience. Candidates who have just completed an advanced analytics degree (Phd) in an associated practice area (marketing or business consulting) will be considered as well. </li><li>Strong theoretical and practical knowledge of analytical techniques like mix modeling, Bayesian and MCMC techniques, agent based approaches, predictive response modeling, sales response modeling, experimental design, cross-sectional and time series analysis, discrete choice modeling, data mining and optimization techniques </li><li>Hands-on expertise working with statistical software like SAS, SPSS, Bayesia, ThinkVine, Concentric, etc. to develop and estimate models. </li><li>Experience with basic SQL querying and programming </li><li>Demonstrated experience in translating analytical model findings to business insights and communicating them to non-technical audiences </li><li>Experience dealing with complex marketing modeling issues such as multiple channel attribution issues, non-linearity, long-term effects and uncertainty. </li></ul><p>Experience developing and implementing statistical solutions for use in the automation of marketing decisions<br> </p>	NA	<p>Richmond-based agency seeks senior level advanced analytics professional with hands-on experience in marketing mix and econometric modeling, advanced customer analytics, revenue forecasting/modeling, demand modeling, marketing optimization channel attribution and allocation methodologies and optimizations. The Decision Scientist will deliver client-specific analyses including: campaign effectiveness analysis, customer segmentation and profiling, retention analysis, lifetime value analysis, and competitive market research related to input and development of decision modeling. The role requires business acumen, top-tier analytical and problem-solving skills and a collaborative partnering style in addition to strong verbal communications and experience with executive presentations. The ideal candidate is versed in business, finance and/or marketing strategy to which the analytics insights will be applied.</p>	Competitive	xXnqTapU_C	Howard	F.	Executive Recruiter, Analytic Recruiting	NA	http://www.linkedin.com/jobs?viewJob=&jobId=4169494&trk=api*a225514*s233466*	New York, NY OR Richmond, VA
4168628	27051	True	2012	11	13	2012	12	13	1352831822000	1355423823000	31265	First Solar Inc	Continuous Improvement Statistician	us	Toledo, Ohio Area	[{"code": "eng", "name": "Engineering"}]	[{"code": "144", "id": 144, "name": "Renewables & Environment"}]	F	Full-time	3	Associate	Please visit www.firstsolar.jobs<br><br>	NA	Our high growth and leadership position in the renewable energy business offers outstanding opportunities to individuals seeking an exciting work environment in one of the most important industries for the 21st century. First Solar is a leader in the development and manufacturing of thin film solar modules used in grid-connected solar power plants, as well as a provider of complete solar generation solutions for U.S. utilities. Our culture is one where teamwork, continuous improvement, achievement of results, and environmental responsibility are core values. We are seeking new associates who are motivated to contribute their talents to making cost-effective solar energy an important part of the worlds energy mix.<br><br><br><br><strong>Basic Job Functions:</strong><br>Position will apply world class analytical tools towards solving business related problems assisting the organization in measuring performance, analyzing results, implementing improvements and establishing control mechanisms. Individual is expected to possess and to develop world class analytical tools that will be utilized in facilitating process improvement teams by providing statistically sound evidence validating the most effective solution paths and serving as an unbiased and independent agent of change. <br><br>The Continuous Improvement Analyst II will assist First Solar associates by aiding in the standardization of the use of the best analytical tools that can be made available for global consumption of development and manufacturing engineering.<br><br><strong>Experience:</strong><br> Masters Level with 3+ years or BS Level with 5+ years of relevant work experience in related statistical analysis preferred. Data mining and understanding of automated business solutions or programming.<br><br><strong>Education:</strong><br> A Masters of Science, or Bachelors of Science degree in Statistics and/or Operational Research, Engineering or a discipline with grounding in Statistics. <br> Six Sigma Green Belt Certification preferred but not required.<br><br><strong>Required Skills:</strong><br> Strong written and verbal communication skills, interpersonal, facilitation, presentation, quantitative, analytical, organizational &amp; follow-up skills, and the ability to meet deadlines on multiple projects/programs.<br> Skills in analyzing large amounts of data and communicating the results in a concise manner<br> Experience with design of experiments (DOE) principles.<br> Desired skill set includes MS SQL, SAS programming, and JMP.<br> Skills with MS Office, Excel, Word, and Power Point etc.<br> Some familiarity with Design for Six Sigma is preferred but not required<br><br><strong>Essential Functions &amp; Responsibilities:</strong><br> Act independently and with minimal management direction to provide expert, hands-on implementation of statistical methods and related analytical tools to capitalize on improvement opportunities.<br> Facilitate the need for change by discovering and highlighting entitlement opportunities by utilizing data mining and analysis techniques<br> Apply statistical principles to the evaluation and solution of technical problems.<br> Support team members in the application of analytical tools towards the support of solving business problems. <br> Standardize analytical tools in the support of converting data into a business intelligence system useful for solving business problems<br> Assist project improvement teams to deliver results and standardize the use of JMP Scripts and/or analytical tools in the measure of the projects progress.<br> Assist assigned functions/project areas to develop and maintain process measurements and controls to monitor current processes.<br> Assist cross-functional project teams to achieve breakthrough process improvements using advanced process control methodologies.<br> Earn and maintain a high level of peer respect to be a leader in critical work process improvement initiatives.<br> Facilitate and lead training sessions in DOE, FMEA, SPC, DMAIC, MSA, and Statistics<br> Support, develop, and enhance business management methodologies and training materials as related to design processes and improvement initiatives.<br> Be a paradigm shifter to help others discover a better improvement process. Challenge conventional wisdom by demonstrating successful application of new methodologies, create innovative thinking, and serve as role models for others.<br><br><strong>Physical Requirements:</strong><br> Will sit, stand or walk short distances for up to 12 hours per day<br> Will climb stairs on an occasional basis<br> Will exert up to 50 pounds of force to lift, push or pull on a seldom basis<br> Will lift, push or pull up to 27 pounds on a frequent basis<br> Required to use hands to grasp, lift, handle, carry or feel objects repetitively on a frequent basis<br> 20/40 vision in each eye, with or without correction, is required<br> Must be able to comply with all safety standards and procedures<br> May reach above shoulder heights and below the waist on a frequent basis<br> May stoop, kneel, or bend, on an occasional basis<br> Ability to wear personal protective equipment is required (including but not limited to; steel toed shoes, gloves, safety glasses, hearing protection, protective jacket or apron and arm guards)<br> All associates working on the production floor may be required to wear a respirator at any given time and thus, the ability to wear a respirator is a condition of employment and continued employment (requires little or no facial hair)<br><br><br><br><strong>Please note:</strong> potential candidates will meet the education and experience requirements provided on the above job description and excel in completing the listed responsibilities for this role. All candidates receiving an offer of employment must successfully complete a background check, pre-employment drug screen, and any other test that may be required for the role.<br><br><strong>Equal Opportunity Employer Statement:</strong> First Solar Inc. is an Equal Opportunity Employer (EOE) that values and respects the importance of a diverse and inclusive workforce. It is the policy of the company to recruit, hire, train and promote persons in all job titles without regard to race, color, religion, sex, age, national origin, veteran status, disability, sexual orientation, or gender identity. We recognize that diversity and inclusion is a driving force in the success of our company.	0	1e4Y6rusSB	Sandy	C.	Corporate Recruiter at First Solar	NA	http://www.linkedin.com/jobs?viewJob=&jobId=4168628&trk=api*a225514*s233466*	Perrysburg, US-OH
4166753	Statistician	True	2012	11	13	2012	12	13	1352822081000	1355414082000	80305	Connections of New York	Data Analyst / Statistician	us	Greater New York City Area	[{"code": "it", "name": "Information Technology"}]	[{"code": "96", "id": 96, "name": "Information Technology and Services"}]	F	Full-time	4	Mid-Senior level	<ol><li>Excellent communication skills </li><ol><li>Experience with writing professional reports and documents </li><li>Experienced presente / Must be able to give an hour or more presentation on statistics </li></ol><li>Experience interacting with clients on a day to day basis </li><li>Fluency in written and spoken English </li><li>Statistical skills<ol><li>Must have MA or equivalent in statistics </li><li>Must have at least 1-2 years experience with data analysis in a professional setting </li><li>Experienced conveying technical concepts in lay terms </li><li>Must be able to think out of the box statistically to solve practical problems </li></ol></li></ol><ol><li>Must be proficient in at least two the statistical software programs listed below </li></ol><p> i. SPSS </p><p> ii. SAS </p><p> iii. R </p><p> iv. STATA </p><p></p>	NA	<p>Senior Data Analyst / Statistician </p><p> </p><p>Based on a deep understanding of the data model and data products, the Data Analyst will perform data query and analysis of the medical claims database to support a variety of internal functions including litigation-related investigation, statistical modeling, quality assurance, research and development, and executive-level reporting. The Data Analyst will work to review, validate, and model data to expand understanding throughout the organization and to support departmental and executive decision making. The Data Analyst will also be responsible for creating and implementing communications about the data within the company and with various constituencies outside the company. </p><p> </p><p>Primary Responsibilities </p><p> </p><p> In the context of litigation support, report on the underlying data that contributes to medical rate data appearing in Health products. As required, communicate such information to Health customer representatives and other external parties. </p><p> Support Health Senior Statistician in statistical modeling and quality assurance activities by creating extracts of underlying data from the data warehouse that can be manipulated in external tools. </p><p> Support the Contributions team by establishing data quality standards and ensuring that the best practices are continually shared and utilized with pertinent constituencies both in and outside the organization. </p><p> Perform a variety of ad hoc queries against the Health data to inform R&amp;D activities and empower executive-level decision making. </p><p>Knowledge and Skill Requirements </p><p> Extensive experience with SQL and the fundamentals of data query and analysis. </p><p> Extensive experience with Relational Database Management systems and relational data models. </p><p> Strong analytic skills. </p><p> At least one college level statistics course required. Advanced statistical skills preferred. </p><p> Experience with spreadsheet and other office productivity applications by which results will be shared with others in the organization. </p><p> Ability to understand and work with data in a variety of formats and to create charts, graphs, tables, and other visual means of representing key aspects of the data. </p><p> Strong written and verbal communications, including the ability to summarize the results of data analysis for technical and non-technical audiences. Must also be comfortable presenting this information via in person meetings as well as webinar technologies. </p><p> Must be skilled at prioritizing assignments and working to ensure all mission critical timeframes and deadlines are met. Must be able to work independently and demonstrate initiative and problem solving skills working within a fast paced start up environment. </p><p> Experience with medical claims data or other healthcare related data preferred. </p><p> Experience with statistical analysis tools such as SAS and Stata, and with Business Intelligence tools. </p><p> Experience with technical writing preferred </p><p></p>	NA	MGBtaK23LV	Russ	A.	SVP Executive Search at Connections of New York	NA	http://www.linkedin.com/jobs?viewJob=&jobId=4166753&trk=api*a225514*s233466*	Greater New York City Area
4165802	NA	True	2012	11	13	2012	12	13	1352817250000	1355409251000	3486	Hays	Clinical Biostatician Cardiovascular (m/f)	de	Germany	[{"code": "sci", "name": "Science"}]	[{"code": "15", "id": 15, "name": "Pharmaceuticals"}]	F	Full-time	3	Associate	<p>Your Qualifications: </p><ul><li>MSc/PhD in Statistics or Mathematics </li><li>Experience in international clinical development of Phase 2-3b/4 studies </li><li>Excellent statistical-methodological knowledge including an excellent working knowledge of SAS </li><li>Very good communication skills </li><li>Experience in cardiovascular trials </li><li>Fluent English </li><li>Knowledge of German would be an advantage, but is not required</li></ul>	NA	<p>We are global leaders in the recruitment of specialists for temporary employment. We are looking for a </p><p> </p><p>Clinical Biostatician Cardiovascular (m/f) </p><p> </p><p>for an employment with Hays Temp GmbH in Rhineland-Palatinate </p><p>Reference number:197172/1 </p><p>Start date:asap </p><p> </p><p>Your Duties: </p><ul><li>In general, work closely together with and support the Project Statistician for Medical Affairs (PSTAT-MA) </li><li>Support the PSTAT-MA to suggest and specify statistical analyses (incl. meta-analyses and subgroup analyses) of the project database for publications, reimbursement decisions and drug defense strategies </li><li>Review of documents and output </li><li>Collaborate with Lead Programmer</li></ul>	NA	c5IaB7RKSn	Kristina	R.	Recruitment Management at Hays	NA	http://www.linkedin.com/jobs?viewJob=&jobId=4165802&trk=api*a225514*s233466*	Rhineland-Palatinate 
